{"$defs":{"actorReference":{"additionalProperties":false,"properties":{"actor_id":{"$ref":"#/$defs/idString"},"actor_type":{"enum":["HUMAN","AGENT","SERVICE","RUNTIME"],"type":"string"},"display_name":{"minLength":1,"type":"string"},"role":{"minLength":1,"type":"string"}},"required":["actor_id","actor_type","role"],"type":"object"},"artifactReference":{"additionalProperties":false,"properties":{"artifact_id":{"$ref":"#/$defs/idString"},"artifact_type":{"minLength":1,"type":"string"},"commit_sha":{"pattern":"^[a-f0-9]{40}$","type":["string","null"]},"location":{"minLength":1,"type":"string"},"sha256":{"pattern":"^[a-f0-9]{64}$","type":"string"}},"required":["artifact_id","artifact_type","location","sha256"],"type":"object"},"authorityReference":{"additionalProperties":false,"properties":{"approval_reference":{"minLength":1,"type":"string"},"authority_id":{"$ref":"#/$defs/idString"},"authority_type":{"enum":["FOUNDER","FORMAL_DELEGATION","POLICY","DOMAIN_OWNER"],"type":"string"},"delegation_record":{"type":["string","null"]},"expires_at":{"format":"date-time","type":["string","null"]},"scope":{"items":{"minLength":1,"type":"string"},"minItems":1,"type":"array","uniqueItems":true}},"required":["authority_id","authority_type","scope","approval_reference"],"type":"object"},"idString":{"pattern":"^[A-Z0-9][A-Z0-9._:/-]{2,}$","type":"string"},"kernelAdmissionOutcome":{"enum":["HOLD","CORRECTION_REQUIRED","PROVISIONAL","ADMITTED"],"type":"string"},"nonEmptyString":{"minLength":1,"type":"string"},"releaseState":{"enum":["RED","BLUE","GREEN"],"type":"string"},"semver":{"pattern":"^(0|[1-9]\\d*)\\.(0|[1-9]\\d*)\\.(0|[1-9]\\d*)(?:-[0-9A-Za-z.-]+)?(?:\\+[0-9A-Za-z.-]+)?$","type":"string"}},"$id":"urn:pfu:schema:evidence-event:1.0.0","$schema":"https://json-schema.org/draft/2020-12/schema","additionalProperties":false,"allOf":[{"if":{"properties":{"verdict":{"const":"PASS"}},"required":["verdict"]},"then":{"properties":{"controls":{"not":{"contains":{"properties":{"status":{"const":"FAIL"}},"required":["status"]}}}}}}],"description":"Immutable, attributable, version-bound evidence event for PFU governance.","properties":{"actor":{"$ref":"#/$defs/actorReference"},"artifacts":{"items":{"$ref":"#/$defs/artifactReference"},"type":"array"},"authority":{"$ref":"#/$defs/authorityReference"},"controls":{"items":{"additionalProperties":false,"properties":{"control_id":{"$ref":"#/$defs/idString"},"evidence":{"items":{"$ref":"#/$defs/nonEmptyString"},"type":"array"},"notes":{"type":"string"},"status":{"enum":["PASS","FAIL","NOT_APPLICABLE"],"type":"string"}},"required":["control_id","status"],"type":"object"},"minItems":1,"type":"array"},"defects":{"items":{"type":"object"},"type":"array"},"event_id":{"$ref":"#/$defs/idString"},"event_type":{"enum":["CONSTITUTIONAL","REGISTRATION","VALIDATION","CONFORMANCE","MUTATION","RELEASE","ROLLBACK","INCIDENT"],"type":"string"},"immutable":{"const":true},"inputs":{"items":{"type":"object"},"type":"array"},"kernel_admission_outcome":{"$ref":"#/$defs/kernelAdmissionOutcome"},"mutations":{"items":{"additionalProperties":false,"properties":{"mutation_type":{"$ref":"#/$defs/nonEmptyString"},"permitted":{"type":"boolean"},"target":{"$ref":"#/$defs/nonEmptyString"}},"required":["target","mutation_type","permitted"],"type":"object"},"type":"array"},"next_authorized_action":{"type":["string","null"]},"occurred_at":{"format":"date-time","type":"string"},"outputs":{"items":{"type":"object"},"type":"array"},"provenance":{"additionalProperties":false,"properties":{"branch":{"$ref":"#/$defs/nonEmptyString"},"repository":{"$ref":"#/$defs/nonEmptyString"},"source_refs":{"items":{"$ref":"#/$defs/nonEmptyString"},"minItems":1,"type":"array","uniqueItems":true}},"required":["repository","branch","source_refs"],"type":"object"},"recorded_at":{"format":"date-time","type":"string"},"release_state":{"$ref":"#/$defs/releaseState"},"residual_risks":{"items":{"$ref":"#/$defs/nonEmptyString"},"type":"array"},"subject":{"additionalProperties":false,"properties":{"commit_sha":{"pattern":"^[a-f0-9]{40}$","type":["string","null"]},"subject_id":{"$ref":"#/$defs/idString"},"subject_type":{"enum":["CONSTITUTION","KERNEL","CAPABILITY","DOMAIN","SYSTEM","MUTATION","RELEASE"],"type":"string"},"version":{"$ref":"#/$defs/semver"}},"required":["subject_id","subject_type","version"],"type":"object"},"verdict":{"enum":["PASS","HOLD","CORRECTION_REQUIRED","FAIL"],"type":"string"}},"required":["event_id","event_type","occurred_at","recorded_at","immutable","actor","authority","subject","provenance","inputs","outputs","controls","artifacts","mutations","defects","residual_risks","kernel_admission_outcome","release_state","verdict"],"title":"PFU Machine Layer — Evidence Event","type":"object"}
