{
  "actor": {
    "actor_id": "OPENAI-CHATGPT-GPT-5-6",
    "actor_type": "AGENT",
    "display_name": "ChatGPT",
    "role": "PFU Authorized Implementor and Validator"
  },
  "artifacts": [
    {
      "artifact_id": "PFU-SCHEMA-CAPABILITY",
      "artifact_type": "json_schema_draft_2020_12",
      "commit_sha": null,
      "location": "contracts/pfu/machine/capability.schema.json",
      "sha256": "28d50f736c627d7cfef83d2892b2ba1d8c6799cff73d3e3dedf89d18a97ce8a2"
    },
    {
      "artifact_id": "PFU-SCHEMA-DOMAIN_CONTRACT",
      "artifact_type": "json_schema_draft_2020_12",
      "commit_sha": null,
      "location": "contracts/pfu/machine/domain-contract.schema.json",
      "sha256": "62513370791085fea65cd7c47ec9b168cb5ef8cb0c275a9ef919213c4f573c60"
    },
    {
      "artifact_id": "PFU-SCHEMA-LIFECYCLE_STATE",
      "artifact_type": "json_schema_draft_2020_12",
      "commit_sha": null,
      "location": "contracts/pfu/machine/lifecycle-state.schema.json",
      "sha256": "acae07a1fdec50585ec935ab86b55b1642dec09430422716e041800c0374c3da"
    },
    {
      "artifact_id": "PFU-SCHEMA-EVIDENCE_EVENT",
      "artifact_type": "json_schema_draft_2020_12",
      "commit_sha": null,
      "location": "contracts/pfu/machine/evidence-event.schema.json",
      "sha256": "ebe73ddcf48c273c4ed8e5471cbc43ad2ff73afd18e32f5c429526ea306f50c9"
    },
    {
      "artifact_id": "PFU-SCHEMA-MUTATION_REQUEST",
      "artifact_type": "json_schema_draft_2020_12",
      "commit_sha": null,
      "location": "contracts/pfu/machine/mutation-request.schema.json",
      "sha256": "e766b8c0bd864f230f5cabd9ecffbc3cde2e0f67c20b741b390c20f3dfebb4ab"
    },
    {
      "artifact_id": "PFU-SCHEMA-RELEASE_VERDICT",
      "artifact_type": "json_schema_draft_2020_12",
      "commit_sha": null,
      "location": "contracts/pfu/machine/release-verdict.schema.json",
      "sha256": "b7beb2b5ed0e259217ac635a1da3d8f2fda7d3b0df2e6570637379f3e8f53e16"
    }
  ],
  "authority": {
    "approval_reference": "Founder command: Generate and validate the 6 machine layer json schemas",
    "authority_id": "RYAN-RICHARD-LEVACK-CARR",
    "authority_type": "FOUNDER",
    "delegation_record": null,
    "expires_at": null,
    "scope": [
      "generate_machine_layer_schemas",
      "validate_machine_layer_schemas",
      "commit_governance_contracts"
    ]
  },
  "controls": [
    {
      "control_id": "PFU-ML-META-001",
      "evidence": [
        "All six schemas passed Draft202012Validator.check_schema."
      ],
      "notes": "",
      "status": "PASS"
    },
    {
      "control_id": "PFU-ML-POSITIVE-001",
      "evidence": [
        "One conforming fixture validated for each schema."
      ],
      "notes": "",
      "status": "PASS"
    },
    {
      "control_id": "PFU-ML-NEGATIVE-001",
      "evidence": [
        "Each schema rejected a fixture missing a required root property."
      ],
      "notes": "",
      "status": "PASS"
    },
    {
      "control_id": "PFU-ML-CONDITIONAL-001",
      "evidence": [
        "Failed lifecycle guard, contradictory PASS evidence, missing material rollback, and GREEN-ready blocker cases were rejected."
      ],
      "notes": "",
      "status": "PASS"
    },
    {
      "control_id": "PFU-ML-BOUNDARY-001",
      "evidence": [
        "No todo-app, runtime, deployment, infrastructure, secret, webhook, worker, or Supabase mutation is included."
      ],
      "notes": "",
      "status": "PASS"
    }
  ],
  "defects": [],
  "event_id": "PFU-MACHINE-LAYER-VALIDATION-2026-08-05-001",
  "event_type": "VALIDATION",
  "immutable": true,
  "inputs": [
    {
      "state": "RATIFIED",
      "type": "constitutional_authority"
    },
    {
      "state": "ACTIVE_GOVERNANCE_ONLY",
      "type": "kernel_authorization"
    },
    {
      "type": "required_schema_count",
      "value": 6
    }
  ],
  "kernel_admission_outcome": "PROVISIONAL",
  "mutations": [
    {
      "mutation_type": "governance_contract_generation",
      "permitted": true,
      "target": "contracts/pfu/machine/"
    },
    {
      "mutation_type": "machine_layer_registration",
      "permitted": true,
      "target": "pfu-system.manifest.yaml"
    },
    {
      "mutation_type": "kernel_contract_binding",
      "permitted": true,
      "target": "docs/pfu/kernel/pfu-os-kernel-spec-v1.md"
    },
    {
      "mutation_type": "merge",
      "permitted": false,
      "target": "main"
    },
    {
      "mutation_type": "activation",
      "permitted": false,
      "target": "domain_runtime"
    }
  ],
  "next_authorized_action": "Run final MERCH SHIP repository conformance and merge-verdict evaluation; do not merge without separate Founder authorization.",
  "occurred_at": "2026-08-05T17:20:00Z",
  "outputs": [
    {
      "schema_count": 6,
      "status": "GENERATED_VALIDATED"
    },
    {
      "python_version": "3.13.5",
      "validator": "python-jsonschema",
      "validator_version": "4.26.0"
    },
    {
      "conditional_rejection_checks": 4,
      "meta_schema_checks": 6,
      "missing_required_rejection_checks": 6,
      "valid_fixture_checks": 6
    }
  ],
  "provenance": {
    "branch": "agent/install-bmos-pfu-kernel-v1",
    "repository": "merchship1-cmyk/merch-ship",
    "source_refs": [
      "docs/pfu/constitution/pfu-constitution-v1.md",
      "docs/pfu/kernel/pfu-os-kernel-spec-v1.md",
      "flows/pfu/capability-lifecycle.yaml",
      "policies/pfu/kernel-enforcement-rules.yaml",
      "policies/pfu/release-policy.yaml",
      "contracts/pfu/capability-registration.schema.yaml",
      "contracts/pfu/domain-runtime.schema.yaml",
      "evidence/pfu/evidence-record.schema.yaml"
    ]
  },
  "recorded_at": "2026-08-05T17:20:00Z",
  "release_state": "BLUE",
  "residual_risks": [
    "Final MERCH SHIP repository conformance has not yet been rerun against the six machine-layer schemas.",
    "PR #17 remains an unmerged draft.",
    "Deployment and runtime activation remain unauthorized."
  ],
  "subject": {
    "commit_sha": null,
    "subject_id": "PFU-MACHINE-LAYER",
    "subject_type": "SYSTEM",
    "version": "1.0.0"
  },
  "verdict": "PASS"
}
