{
  "actor": {
    "actor_id": "OPENAI-CHATGPT-GPT-5-6",
    "actor_type": "AGENT",
    "display_name": "ChatGPT",
    "role": "PFU Authorized Implementor and Evidence Analyst"
  },
  "artifacts": [
    {
      "artifact_id": "PFU-MERCH-SHIP-DOMAIN-PROFILE",
      "artifact_type": "yaml_domain_contract_instance",
      "commit_sha": "750de6dfb1ce3906baa077ae15bcaf552956371a",
      "location": "manifests/pfu/domains/merch-ship-runtime-profile.yaml",
      "sha256": "242a8f04bce7b244868db0a44369aaa3f19a5bbd47078a86c9d15467665a0ba9"
    },
    {
      "artifact_id": "PFU-SCHEMA-DOMAIN-CONTRACT",
      "artifact_type": "json_schema_draft_2020_12",
      "commit_sha": "750de6dfb1ce3906baa077ae15bcaf552956371a",
      "location": "contracts/pfu/machine/domain-contract.schema.json",
      "sha256": "62513370791085fea65cd7c47ec9b168cb5ef8cb0c275a9ef919213c4f573c60"
    }
  ],
  "authority": {
    "approval_reference": "Founder authorized profile migration and evaluation, while explicitly prohibiting merge and deployment.",
    "authority_id": "RYAN-RICHARD-LEVACK-CARR",
    "authority_type": "FOUNDER",
    "delegation_record": null,
    "expires_at": null,
    "scope": [
      "migrate_merch_ship_domain_profile",
      "validate_domain_contract",
      "rerun_final_conformance",
      "rerun_merge_verdict"
    ]
  },
  "controls": [
    {
      "control_id": "PAP-004-EVIDENCE-PACKET",
      "evidence": [
        "Version-bound post-migration conformance packet generated."
      ],
      "notes": "",
      "status": "PASS"
    },
    {
      "control_id": "PAP-007-PROTECTED-PATH",
      "evidence": [
        "Comparison with main contains no todo-app/ changes."
      ],
      "notes": "",
      "status": "PASS"
    },
    {
      "control_id": "PAP-008-REPOSITORY-DIVERGENCE",
      "evidence": [
        "Feature branch is 43 commits ahead and 0 behind main."
      ],
      "notes": "",
      "status": "PASS"
    },
    {
      "control_id": "PFU-DOMAIN-CONTRACT",
      "evidence": [
        "Migrated MERCH SHIP profile validates with zero errors against domain-contract.schema.json v1.0.0."
      ],
      "notes": "All 12 legacy-shape violations are resolved.",
      "status": "PASS"
    },
    {
      "control_id": "PFU-KERNEL-BINDING",
      "evidence": [
        "Constitution remains RATIFIED; kernel remains ACTIVE_GOVERNANCE_ONLY; PFU release remains BLUE."
      ],
      "notes": "",
      "status": "PASS"
    }
  ],
  "defects": [],
  "event_id": "PFU-MERCH-SHIP-CONFORMANCE-2026-08-05-002",
  "event_type": "CONFORMANCE",
  "immutable": true,
  "inputs": [
    {
      "previous_profile_commit": "a0e861c32d2503e9c40ca3695a729a6756cf4fa1"
    },
    {
      "migrated_profile_commit": "750de6dfb1ce3906baa077ae15bcaf552956371a"
    },
    {
      "previous_domain_contract_violations": 12
    },
    {
      "pull_request": 17
    }
  ],
  "kernel_admission_outcome": "PROVISIONAL",
  "mutations": [
    {
      "mutation_type": "domain_profile_contract_migration",
      "permitted": true,
      "target": "manifests/pfu/domains/merch-ship-runtime-profile.yaml"
    },
    {
      "mutation_type": "evidence_record_creation",
      "permitted": true,
      "target": "evidence/pfu/merch-ship-post-migration-conformance-2026-08-05.event.json"
    },
    {
      "mutation_type": "merge",
      "permitted": false,
      "target": "main"
    },
    {
      "mutation_type": "deployment_or_runtime_activation",
      "permitted": false,
      "target": "deployment_or_runtime"
    }
  ],
  "next_authorized_action": "Run or observe CI for commit 750de6dfb1ce3906baa077ae15bcaf552956371a, then rerun merge-verdict evaluation. Do not merge or deploy.",
  "occurred_at": "2026-08-05T21:19:00Z",
  "outputs": [
    {
      "domain_contract_validation": "PASS",
      "violation_count": 0
    },
    {
      "repository_divergence": "43_AHEAD_0_BEHIND"
    },
    {
      "protected_path_integrity": "PASS",
      "todo_app_diff": 0
    },
    {
      "heritage_ci": "PENDING_NO_RUN_ATTACHED"
    },
    {
      "merge_verdict": "HOLD_PENDING_CI"
    }
  ],
  "provenance": {
    "branch": "agent/install-bmos-pfu-kernel-v1",
    "repository": "merchship1-cmyk/merch-ship",
    "source_refs": [
      "manifests/pfu/domains/merch-ship-runtime-profile.yaml",
      "contracts/pfu/machine/domain-contract.schema.json",
      "contracts/pfu/machine/evidence-event.schema.json",
      "contracts/pfu/machine/release-verdict.schema.json",
      "evidence/pfu/merch-ship-final-conformance-2026-08-05.event.json",
      "evidence/pfu/pr-17-merge-verdict-2026-08-05.json"
    ]
  },
  "recorded_at": "2026-08-05T21:19:00Z",
  "release_state": "BLUE",
  "residual_risks": [
    "No GitHub Actions workflow run or status is attached to commit 750de6dfb1ce3906baa077ae15bcaf552956371a at evaluation time.",
    "PR #17 remains draft and unmerged.",
    "Deployment, runtime activation, domain mutation, and public release remain unauthorized."
  ],
  "subject": {
    "commit_sha": "750de6dfb1ce3906baa077ae15bcaf552956371a",
    "subject_id": "PFU-DOMAIN-MERCH-SHIP",
    "subject_type": "DOMAIN",
    "version": "1.0.0"
  },
  "verdict": "HOLD"
}
